<?xml version="1.0"?>
<!DOCTYPE Report
[
<!ELEMENT Report (General ,(Doc|BPT)) >
<!ATTLIST Report ver CDATA #REQUIRED tmZone CDATA #REQUIRED>

<!ELEMENT General ( DocLocation ) >
<!ATTLIST General productName CDATA #REQUIRED productVer CDATA #REQUIRED os CDATA #REQUIRED host CDATA #REQUIRED qcserver CDATA #IMPLIED qcproject CDATA #IMPLIED SolManSolutionId CDATA #IMPLIED SolManProjectId CDATA #IMPLIED SolManTestPlanId CDATA #IMPLIED SolManTestPackageId CDATA #IMPLIED SolManUserInfoData CDATA #IMPLIED  >

<!ELEMENT BPT (DName,Res,DVer?,TSet?,TInst?,NodeArgs,AdditionalInfo*,Doc*) >
<!ATTLIST BPT rID ID #REQUIRED >

<!ELEMENT Doc (DName,ConfName?,Res,DVer?,TSet?,TInst?,RunType?,DT?,AdditionalInfo*,Step*,DIter*,Step*,Action*,Doc*,Summary?,TestMaintenanceSummary*,NodeArgs?) >
<!ATTLIST Doc rID ID #REQUIRED type (Test|BC|BPTWrapperTest|Flow|Group|Action) "Test" productName CDATA #REQUIRED BCIter CDATA #IMPLIED >

<!ELEMENT RunType ( #PCDATA )>
<!ATTLIST RunType fmStep (False|True) "False" batch (False|True) "False" upDesc (False|True) "False" upChk (False|True) "False" upAS (False|True) "False">

<!ELEMENT DName ( #PCDATA ) >

<!ELEMENT ConfName ( #PCDATA ) >

<!ELEMENT Res ( #PCDATA ) >

<!ELEMENT AdditionalInfo (AdditionalDataName,AdditionalDataValue ) >

<!ELEMENT AdditionalDataName ( #PCDATA ) >

<!ELEMENT AdditionalDataValue ( #PCDATA ) >

<!ELEMENT DVer ( #PCDATA ) >

<!ELEMENT TSet ( #PCDATA ) >

<!ELEMENT TInst ( #PCDATA ) >

<!ELEMENT DIter (Step*,Action+,Summary?,NodeArgs)>
<!ATTLIST DIter rID ID #REQUIRED iterID CDATA #REQUIRED>

<!ELEMENT DocLocation ( #PCDATA )>

<!ELEMENT Action (AName,AIter*,(Step|HtmlStep|Action)*, Summary,ActionMaintenanceSummary*, NodeArgs ) >
<!ATTLIST Action rID ID #REQUIRED>

<!ELEMENT AIter ((Step|HtmlStep|Action)*,DataMapping?, Summary?,NodeArgs) >
<!ATTLIST AIter rID ID #REQUIRED iterID CDATA #REQUIRED isCountable (False|True) "False" >

<!ELEMENT AName ( #PCDATA ) >

<!ELEMENT TestMaintenanceSummary (ActionMaintenanceSummary*) >
<!ATTLIST TestMaintenanceSummary ObjectsAdded CDATA #REQUIRED ObjectsUpdated CDATA #REQUIRED StepsUpdated CDATA #REQUIRED StepsComments CDATA #REQUIRED><!ELEMENT ActionMaintenanceSummary (ObjectChange* ) >
<!ATTLIST ActionMaintenanceSummary Action CDATA #REQUIRED Objects CDATA #REQUIRED Updated CDATA #REQUIRED LinesTotal CDATA #REQUIRED Added CDATA #REQUIRED LinesUpdated CDATA #REQUIRED>

<!ELEMENT ObjectChange  (Hierarchy, PropertyChangeList* ) >
<!ATTLIST ObjectChange Operation CDATA #IMPLIED OriginalRepository CDATA #IMPLIED>

<!ELEMENT PropertyChangeList (PropertyDef*) >

<!ELEMENT PropertyDef (OriginalValue, NewValue) >
<!ATTLIST PropertyDef PropName CDATA #REQUIRED OriginRegularExpression (True|False) "False" NewRegularExpression (True|False) "False" AddedProperty (True|False) "False" >

<!ELEMENT OriginalValue ( #PCDATA )>

<!ELEMENT NewValue ( #PCDATA )>

<!ELEMENT Hierarchy  (ObjectName, Hierarchy*) >
<!ATTLIST Hierarchy MicClass CDATA #REQUIRED>

<!ELEMENT ObjectName  ( #PCDATA ) >

<!ELEMENT Step (Obj,Details,Time,TimeTick* ,(Step|HtmlStep|Doc)*, DataMapping?, NodeArgs) >
<!ATTLIST Step rID ID #REQUIRED retval CDATA #IMPLIED>

<!ELEMENT HtmlStep (HTML,TimeTick*,(Step|HtmlStep|Doc)*,NodeArgs) >
<!ATTLIST HtmlStep rID ID #REQUIRED >

<!ELEMENT Obj ( #PCDATA ) >
<!ATTLIST Obj plainTxt (False|True) "True">

<!ELEMENT Details ( #PCDATA ) >
<!ATTLIST Details plainTxt (False|True) "True">

<!ELEMENT Time ( #PCDATA ) >

<!ELEMENT HTML ( #PCDATA ) >

<!ELEMENT Disp ( #PCDATA ) >

<!ELEMENT TimeTick ( #PCDATA ) >

<!ELEMENT DataMapping ( DataMappedItem* )>
<!ELEMENT DataMappedItem EMPTY >
<!ATTLIST DataMappedItem dsName CDATA #REQUIRED >
<!ATTLIST DataMappedItem rowId CDATA #REQUIRED >

<!ELEMENT NodeArgs (Disp,TopPane?,BtmPane?,ExtendedInfo? )>
<!ATTLIST NodeArgs eType CDATA #REQUIRED icon CDATA #REQUIRED nRep CDATA #REQUIRED UserNote CDATA #IMPLIED filter (False|True) "True">
<!ATTLIST NodeArgs status (Passed|Failed|Done|Warning|Information) "Done">
<!ATTLIST NodeArgs iconSel CDATA #IMPLIED nType CDATA #IMPLIED MovieMarker CDATA "">
<!ATTLIST NodeArgs Source CDATA #IMPLIED SourceLine CDATA #IMPLIED StepFlowItemKey CDATA #IMPLIED >

<!ELEMENT TopPane (Path)>

<!ELEMENT BtmPane ( (Path|WR)?,ASHilite?)>
<!ATTLIST BtmPane vType CDATA "HTML">

<!ELEMENT Path ( #PCDATA ) >

<!ELEMENT ASHilite ( #PCDATA ) >

<!ELEMENT WR ( #PCDATA ) >

<!ELEMENT ExtendedInfo ( StepData ) >

<!ATTLIST ExtendedInfo StepType CDATA #REQUIRED>
<!ELEMENT DT (NodeArgs) >
<!ATTLIST DT rID ID #REQUIRED>

<!ELEMENT Summary (Param*)>
<!ATTLIST Summary sTime CDATA #IMPLIED eTime CDATA #IMPLIED passed CDATA #IMPLIED failed CDATA #IMPLIED warnings CDATA #IMPLIED retval CDATA #IMPLIED stopped (False|True) "False" >

<!ELEMENT Param (ParamName,ParamVal)+ >
<!ATTLIST Param paramInOut (In|Out) "In">

<!ELEMENT ParamName ( #PCDATA ) >

<!ELEMENT ParamVal ( #PCDATA ) >

]
>
<Report ver="2.0" tmZone="Coordinated Universal Time">
<General productName="Vugen" productVer="2023" os="" host="AZWLRUNNER02P"><DocLocation><![CDATA[C:\PERF\PT_APP_LIST\WMX\WMX_ALLDCs\G4\Blankscript]]></DocLocation></General>
<Doc rID="T1"   productName= "Vugen"  >
<DName><![CDATA[Blankscript]]></DName>
<Res><![CDATA[result1]]></Res>
<Action rID="T2">
<AName><![CDATA[vuser_init]]></AName>
<Step rID="T3">
<Obj plainTxt="False" ><![CDATA[Service: Set Sockets Option]]></Obj>
<Details plainTxt="False" ><![CDATA[<CENTER>Set socket option <STRONG><FONT COLOR=#00AF00>SSL_VERSION</FONT></STRONG> with value <STRONG><FONT COLOR=#00AF00>AUTO</FONT></STRONG></CENTER>]]></Details>
<Time><![CDATA[11/7/2024 - 9:35:44]]></Time>
<TimeTick>1730972144</TimeTick>
<NodeArgs eType="General" icon="3" nRep="6" >
<Disp><![CDATA[Service: Set Sockets Option]]></Disp>
</NodeArgs>
</Step>
<Step rID="T4">
<Obj plainTxt="False" ><![CDATA[Service: Set Max Html Param Len]]></Obj>
<Details plainTxt="False" ><![CDATA[<CENTER>Maximum length of a HTML string that can be retrieved and saved set to <STRONG><FONT COLOR=#00AF00>1024</FONT></STRONG> characters</CENTER>]]></Details>
<Time><![CDATA[11/7/2024 - 9:35:44]]></Time>
<TimeTick>1730972144</TimeTick>
<NodeArgs eType="General" icon="4" nRep="7" >
<Disp><![CDATA[Service: Set Max Html Param Len]]></Disp>
</NodeArgs>
</Step>
<Step rID="T5">
<Obj plainTxt="False" ><![CDATA[Service: Add Cookie]]></Obj>
<Details plainTxt="False" ><![CDATA[<CENTER>Add the following cookie: <STRONG><FONT COLOR=#00AF00>currentLoginPage=Web; DOMAIN=qa.wmxbolt.wescodist.com</FONT></STRONG></CENTER>]]></Details>
<Time><![CDATA[11/7/2024 - 9:35:44]]></Time>
<TimeTick>1730972144</TimeTick>
<NodeArgs eType="General" icon="5" nRep="8" >
<Disp><![CDATA[Service: Add Cookie]]></Disp>
</NodeArgs>
</Step>
<Step rID="T6">
<Obj plainTxt="False" ><![CDATA[Service: Reg Save Param]]></Obj>
<Details plainTxt="False" ><![CDATA[<CENTER>ParamName =<STRONG><FONT COLOR=#00AF00>C_FlowIDLogin</FONT></STRONG><BR>Left Boundary = <STRONG><FONT COLOR=#00AF00>LB/IC=name="flowId" value="</FONT></STRONG><BR>Right Boundary = <STRONG><FONT COLOR=#00AF00>RB/IC=" /></FONT></STRONG><BR>Instance = <STRONG><FONT COLOR=#00AF00>Ord=1</FONT></STRONG></CENTER>]]></Details>
<Time><![CDATA[11/7/2024 - 9:35:44]]></Time>
<TimeTick>1730972144</TimeTick>
<NodeArgs eType="General" icon="6" nRep="9" >
<Disp><![CDATA[Service: Reg Save Param]]></Disp>
</NodeArgs>
</Step>
<Step rID="T7">
<Obj plainTxt="False" ><![CDATA[Service: Reg Save Param]]></Obj>
<Details plainTxt="False" ><![CDATA[<CENTER>ParamName =<STRONG><FONT COLOR=#00AF00>C_ViewState</FONT></STRONG><BR>Left Boundary = <STRONG><FONT COLOR=#00AF00>LB/IC=id="javax.faces.ViewState" value="</FONT></STRONG><BR>Right Boundary = <STRONG><FONT COLOR=#00AF00>RB/IC=" /></FONT></STRONG><BR>Instance = <STRONG><FONT COLOR=#00AF00>Ord=1</FONT></STRONG></CENTER>]]></Details>
<Time><![CDATA[11/7/2024 - 9:35:44]]></Time>
<TimeTick>1730972144</TimeTick>
<NodeArgs eType="General" icon="6" nRep="10" >
<Disp><![CDATA[Service: Reg Save Param]]></Disp>
</NodeArgs>
</Step>
<Step rID="T8">
<Obj plainTxt="False" ><![CDATA[Url: wmx]]></Obj>
<Details plainTxt="False" ><![CDATA[<CENTER><STRONG><FONT COLOR=#009A63>Step completed successfully</FONT></STRONG></CENTER>]]></Details>
<Time><![CDATA[11/7/2024 - 9:35:44]]></Time>
<TimeTick>1730972144</TimeTick>
<NodeArgs eType="General" icon="7" nRep="11" status="Passed" >
<Disp><![CDATA[Url: wmx]]></Disp>
<BtmPane vType="HTMLSNSH" >
<Path><![CDATA[\Iteration1\t1.inf]]></Path>
</BtmPane>
</NodeArgs>
</Step>
<Step rID="T9">
<Obj plainTxt="False" ><![CDATA[Service: Reg Save Param]]></Obj>
<Details plainTxt="False" ><![CDATA[<CENTER>ParamName =<STRONG><FONT COLOR=#00AF00>C_ViewState1</FONT></STRONG><BR>Left Boundary = <STRONG><FONT COLOR=#00AF00>LB/IC=id="javax.faces.ViewState" value="</FONT></STRONG><BR>Right Boundary = <STRONG><FONT COLOR=#00AF00>RB/IC=" /></FONT></STRONG><BR>Instance = <STRONG><FONT COLOR=#00AF00>Ord=1</FONT></STRONG></CENTER>]]></Details>
<Time><![CDATA[11/7/2024 - 9:35:45]]></Time>
<TimeTick>1730972145</TimeTick>
<NodeArgs eType="General" icon="6" nRep="12" >
<Disp><![CDATA[Service: Reg Save Param]]></Disp>
</NodeArgs>
</Step>
<Step rID="T10">
<Obj plainTxt="False" ><![CDATA[Submit Data: login.faces]]></Obj>
<Details plainTxt="False" ><![CDATA[<CENTER><STRONG><FONT COLOR=#009A63>Step completed successfully</FONT></STRONG></CENTER>]]></Details>
<Time><![CDATA[11/7/2024 - 9:35:45]]></Time>
<TimeTick>1730972145</TimeTick>
<NodeArgs eType="General" icon="8" nRep="13" status="Passed" >
<Disp><![CDATA[Submit Data: login.faces]]></Disp>
<BtmPane vType="HTMLSNSH" >
<Path><![CDATA[\Iteration1\t2.inf]]></Path>
</BtmPane>
</NodeArgs>
</Step>
<Step rID="T11">
<Obj plainTxt="False" ><![CDATA[Service: Add Cookie]]></Obj>
<Details plainTxt="False" ><![CDATA[<CENTER>Add the following cookie: <STRONG><FONT COLOR=#00AF00>security.client.type=Web; DOMAIN=qa.wmxbolt.wescodist.com</FONT></STRONG></CENTER>]]></Details>
<Time><![CDATA[11/7/2024 - 9:35:45]]></Time>
<TimeTick>1730972145</TimeTick>
<NodeArgs eType="General" icon="5" nRep="14" >
<Disp><![CDATA[Service: Add Cookie]]></Disp>
</NodeArgs>
</Step>
<Step rID="T12">
<Obj plainTxt="False" ><![CDATA[Service: Reg Find]]></Obj>
<Details plainTxt="False" ><![CDATA[<CENTER><STRONG><FONT COLOR=#00AF00>Text=Welcome</FONT></STRONG></CENTER>]]></Details>
<Time><![CDATA[11/7/2024 - 9:35:45]]></Time>
<TimeTick>1730972145</TimeTick>
<NodeArgs eType="General" icon="9" nRep="15" >
<Disp><![CDATA[Service: Reg Find]]></Disp>
</NodeArgs>
</Step>
<Step rID="T13">
<Obj plainTxt="False" ><![CDATA[Submit Data: login.faces_2]]></Obj>
<Details plainTxt="False" ><![CDATA[<CENTER><STRONG><FONT COLOR=#009A63>Step completed successfully</FONT></STRONG></CENTER>]]></Details>
<Time><![CDATA[11/7/2024 - 9:35:46]]></Time>
<TimeTick>1730972146</TimeTick>
<NodeArgs eType="General" icon="8" nRep="16" status="Passed" >
<Disp><![CDATA[Submit Data: login.faces_2]]></Disp>
<BtmPane vType="HTMLSNSH" >
<Path><![CDATA[\Iteration1\t3.inf]]></Path>
</BtmPane>
</NodeArgs>
</Step>
<Summary sTime="11/7/2024 - 9:35:43" eTime="11/7/2024 - 9:35:47" passed="3" failed="0" warnings="0" ></Summary>
<NodeArgs eType="StartAction" icon="2" nRep="5" status="Passed" >
<Disp><![CDATA[vuser_init Summary]]></Disp>
</NodeArgs>
</Action>
<DIter rID="T14" iterID="1" >
<Action rID="T15">
<AName><![CDATA[Action]]></AName>
<Summary sTime="11/7/2024 - 9:35:47" eTime="11/7/2024 - 9:35:47" passed="0" failed="0" warnings="0" ></Summary>
<NodeArgs eType="StartAction" icon="2" nRep="19" >
<Disp><![CDATA[Action Summary]]></Disp>
</NodeArgs>
</Action>
<NodeArgs eType="StartIteration" icon="10" nRep="18" >
<Disp><![CDATA[Blankscript Iteration 1 (Row 1)]]></Disp>
</NodeArgs>
</DIter>
<DIter rID="T16" iterID="2" >
<Action rID="T17">
<AName><![CDATA[Action]]></AName>
<Summary sTime="11/7/2024 - 9:35:47" eTime="11/7/2024 - 9:35:47" passed="0" failed="0" warnings="0" ></Summary>
<NodeArgs eType="StartAction" icon="2" nRep="23" >
<Disp><![CDATA[Action Summary]]></Disp>
</NodeArgs>
</Action>
<NodeArgs eType="StartIteration" icon="10" nRep="22" >
<Disp><![CDATA[Blankscript Iteration 2 (Row 2)]]></Disp>
</NodeArgs>
</DIter>
<DIter rID="T18" iterID="3" >
<Action rID="T19">
<AName><![CDATA[Action]]></AName>
<Summary sTime="11/7/2024 - 9:35:47" eTime="11/7/2024 - 9:35:47" passed="0" failed="0" warnings="0" ></Summary>
<NodeArgs eType="StartAction" icon="2" nRep="27" >
<Disp><![CDATA[Action Summary]]></Disp>
</NodeArgs>
</Action>
<NodeArgs eType="StartIteration" icon="10" nRep="26" >
<Disp><![CDATA[Blankscript Iteration 3 (Row 3)]]></Disp>
</NodeArgs>
</DIter>
<DIter rID="T20" iterID="4" >
<Action rID="T21">
<AName><![CDATA[Action]]></AName>
<Summary sTime="11/7/2024 - 9:35:47" eTime="11/7/2024 - 9:35:47" passed="0" failed="0" warnings="0" ></Summary>
<NodeArgs eType="StartAction" icon="2" nRep="31" >
<Disp><![CDATA[Action Summary]]></Disp>
</NodeArgs>
</Action>
<NodeArgs eType="StartIteration" icon="10" nRep="30" >
<Disp><![CDATA[Blankscript Iteration 4 (Row 4)]]></Disp>
</NodeArgs>
</DIter>
<DIter rID="T22" iterID="5" >
<Action rID="T23">
<AName><![CDATA[Action]]></AName>
<Summary sTime="11/7/2024 - 9:35:47" eTime="11/7/2024 - 9:35:47" passed="0" failed="0" warnings="0" ></Summary>
<NodeArgs eType="StartAction" icon="2" nRep="35" >
<Disp><![CDATA[Action Summary]]></Disp>
</NodeArgs>
</Action>
<NodeArgs eType="StartIteration" icon="10" nRep="34" >
<Disp><![CDATA[Blankscript Iteration 5 (Row 5)]]></Disp>
</NodeArgs>
</DIter>
<DIter rID="T24" iterID="6" >
<Action rID="T25">
<AName><![CDATA[Action]]></AName>
<Summary sTime="11/7/2024 - 9:35:47" eTime="11/7/2024 - 9:35:47" passed="0" failed="0" warnings="0" ></Summary>
<NodeArgs eType="StartAction" icon="2" nRep="39" >
<Disp><![CDATA[Action Summary]]></Disp>
</NodeArgs>
</Action>
<NodeArgs eType="StartIteration" icon="10" nRep="38" >
<Disp><![CDATA[Blankscript Iteration 6 (Row 6)]]></Disp>
</NodeArgs>
</DIter>
<DIter rID="T26" iterID="7" >
<Action rID="T27">
<AName><![CDATA[Action]]></AName>
<Summary sTime="11/7/2024 - 9:35:47" eTime="11/7/2024 - 9:35:47" passed="0" failed="0" warnings="0" ></Summary>
<NodeArgs eType="StartAction" icon="2" nRep="43" >
<Disp><![CDATA[Action Summary]]></Disp>
</NodeArgs>
</Action>
<NodeArgs eType="StartIteration" icon="10" nRep="42" >
<Disp><![CDATA[Blankscript Iteration 7 (Row 7)]]></Disp>
</NodeArgs>
</DIter>
<DIter rID="T28" iterID="8" >
<Action rID="T29">
<AName><![CDATA[Action]]></AName>
<Summary sTime="11/7/2024 - 9:35:47" eTime="11/7/2024 - 9:35:47" passed="0" failed="0" warnings="0" ></Summary>
<NodeArgs eType="StartAction" icon="2" nRep="47" >
<Disp><![CDATA[Action Summary]]></Disp>
</NodeArgs>
</Action>
<NodeArgs eType="StartIteration" icon="10" nRep="46" >
<Disp><![CDATA[Blankscript Iteration 8 (Row 8)]]></Disp>
</NodeArgs>
</DIter>
<DIter rID="T30" iterID="9" >
<Action rID="T31">
<AName><![CDATA[Action]]></AName>
<Summary sTime="11/7/2024 - 9:35:47" eTime="11/7/2024 - 9:35:47" passed="0" failed="0" warnings="0" ></Summary>
<NodeArgs eType="StartAction" icon="2" nRep="51" >
<Disp><![CDATA[Action Summary]]></Disp>
</NodeArgs>
</Action>
<NodeArgs eType="StartIteration" icon="10" nRep="50" >
<Disp><![CDATA[Blankscript Iteration 9 (Row 9)]]></Disp>
</NodeArgs>
</DIter>
<DIter rID="T32" iterID="10" >
<Action rID="T33">
<AName><![CDATA[Action]]></AName>
<Summary sTime="11/7/2024 - 9:35:47" eTime="11/7/2024 - 9:35:47" passed="0" failed="0" warnings="0" ></Summary>
<NodeArgs eType="StartAction" icon="2" nRep="55" >
<Disp><![CDATA[Action Summary]]></Disp>
</NodeArgs>
</Action>
<NodeArgs eType="StartIteration" icon="10" nRep="54" >
<Disp><![CDATA[Blankscript Iteration 10 (Row 10)]]></Disp>
</NodeArgs>
</DIter>
<DIter rID="T34" iterID="11" >
<Action rID="T35">
<AName><![CDATA[Action]]></AName>
<Summary sTime="11/7/2024 - 9:35:47" eTime="11/7/2024 - 9:35:47" passed="0" failed="0" warnings="0" ></Summary>
<NodeArgs eType="StartAction" icon="2" nRep="59" >
<Disp><![CDATA[Action Summary]]></Disp>
</NodeArgs>
</Action>
<NodeArgs eType="StartIteration" icon="10" nRep="58" >
<Disp><![CDATA[Blankscript Iteration 11 (Row 11)]]></Disp>
</NodeArgs>
</DIter>
<DIter rID="T36" iterID="12" >
<Action rID="T37">
<AName><![CDATA[Action]]></AName>
<Summary sTime="11/7/2024 - 9:35:47" eTime="11/7/2024 - 9:35:47" passed="0" failed="0" warnings="0" ></Summary>
<NodeArgs eType="StartAction" icon="2" nRep="63" >
<Disp><![CDATA[Action Summary]]></Disp>
</NodeArgs>
</Action>
<NodeArgs eType="StartIteration" icon="10" nRep="62" >
<Disp><![CDATA[Blankscript Iteration 12 (Row 12)]]></Disp>
</NodeArgs>
</DIter>
<DIter rID="T38" iterID="13" >
<Action rID="T39">
<AName><![CDATA[Action]]></AName>
<Summary sTime="11/7/2024 - 9:35:47" eTime="11/7/2024 - 9:35:47" passed="0" failed="0" warnings="0" ></Summary>
<NodeArgs eType="StartAction" icon="2" nRep="67" >
<Disp><![CDATA[Action Summary]]></Disp>
</NodeArgs>
</Action>
<NodeArgs eType="StartIteration" icon="10" nRep="66" >
<Disp><![CDATA[Blankscript Iteration 13 (Row 13)]]></Disp>
</NodeArgs>
</DIter>
<DIter rID="T40" iterID="14" >
<Action rID="T41">
<AName><![CDATA[Action]]></AName>
<Summary sTime="11/7/2024 - 9:35:47" eTime="11/7/2024 - 9:35:47" passed="0" failed="0" warnings="0" ></Summary>
<NodeArgs eType="StartAction" icon="2" nRep="71" >
<Disp><![CDATA[Action Summary]]></Disp>
</NodeArgs>
</Action>
<NodeArgs eType="StartIteration" icon="10" nRep="70" >
<Disp><![CDATA[Blankscript Iteration 14 (Row 14)]]></Disp>
</NodeArgs>
</DIter>
<DIter rID="T42" iterID="15" >
<Action rID="T43">
<AName><![CDATA[Action]]></AName>
<Summary sTime="11/7/2024 - 9:35:47" eTime="11/7/2024 - 9:35:47" passed="0" failed="0" warnings="0" ></Summary>
<NodeArgs eType="StartAction" icon="2" nRep="75" >
<Disp><![CDATA[Action Summary]]></Disp>
</NodeArgs>
</Action>
<NodeArgs eType="StartIteration" icon="10" nRep="74" >
<Disp><![CDATA[Blankscript Iteration 15 (Row 15)]]></Disp>
</NodeArgs>
</DIter>
<DIter rID="T44" iterID="16" >
<Action rID="T45">
<AName><![CDATA[Action]]></AName>
<Summary sTime="11/7/2024 - 9:35:47" eTime="11/7/2024 - 9:35:47" passed="0" failed="0" warnings="0" ></Summary>
<NodeArgs eType="StartAction" icon="2" nRep="79" >
<Disp><![CDATA[Action Summary]]></Disp>
</NodeArgs>
</Action>
<NodeArgs eType="StartIteration" icon="10" nRep="78" >
<Disp><![CDATA[Blankscript Iteration 16 (Row 16)]]></Disp>
</NodeArgs>
</DIter>
<DIter rID="T46" iterID="17" >
<Action rID="T47">
<AName><![CDATA[Action]]></AName>
<Summary sTime="11/7/2024 - 9:35:47" eTime="11/7/2024 - 9:35:47" passed="0" failed="0" warnings="0" ></Summary>
<NodeArgs eType="StartAction" icon="2" nRep="83" >
<Disp><![CDATA[Action Summary]]></Disp>
</NodeArgs>
</Action>
<NodeArgs eType="StartIteration" icon="10" nRep="82" >
<Disp><![CDATA[Blankscript Iteration 17 (Row 17)]]></Disp>
</NodeArgs>
</DIter>
<DIter rID="T48" iterID="18" >
<Action rID="T49">
<AName><![CDATA[Action]]></AName>
<Summary sTime="11/7/2024 - 9:35:47" eTime="11/7/2024 - 9:35:47" passed="0" failed="0" warnings="0" ></Summary>
<NodeArgs eType="StartAction" icon="2" nRep="87" >
<Disp><![CDATA[Action Summary]]></Disp>
</NodeArgs>
</Action>
<NodeArgs eType="StartIteration" icon="10" nRep="86" >
<Disp><![CDATA[Blankscript Iteration 18 (Row 18)]]></Disp>
</NodeArgs>
</DIter>
<DIter rID="T50" iterID="19" >
<Action rID="T51">
<AName><![CDATA[Action]]></AName>
<Summary sTime="11/7/2024 - 9:35:47" eTime="11/7/2024 - 9:35:47" passed="0" failed="0" warnings="0" ></Summary>
<NodeArgs eType="StartAction" icon="2" nRep="91" >
<Disp><![CDATA[Action Summary]]></Disp>
</NodeArgs>
</Action>
<NodeArgs eType="StartIteration" icon="10" nRep="90" >
<Disp><![CDATA[Blankscript Iteration 19 (Row 19)]]></Disp>
</NodeArgs>
</DIter>
<DIter rID="T52" iterID="20" >
<Action rID="T53">
<AName><![CDATA[Action]]></AName>
<Summary sTime="11/7/2024 - 9:35:47" eTime="11/7/2024 - 9:35:47" passed="0" failed="0" warnings="0" ></Summary>
<NodeArgs eType="StartAction" icon="2" nRep="95" >
<Disp><![CDATA[Action Summary]]></Disp>
</NodeArgs>
</Action>
<NodeArgs eType="StartIteration" icon="10" nRep="94" >
<Disp><![CDATA[Blankscript Iteration 20 (Row 20)]]></Disp>
</NodeArgs>
</DIter>
<DIter rID="T54" iterID="21" >
<Action rID="T55">
<AName><![CDATA[Action]]></AName>
<Summary sTime="11/7/2024 - 9:35:47" eTime="11/7/2024 - 9:35:47" passed="0" failed="0" warnings="0" ></Summary>
<NodeArgs eType="StartAction" icon="2" nRep="99" >
<Disp><![CDATA[Action Summary]]></Disp>
</NodeArgs>
</Action>
<NodeArgs eType="StartIteration" icon="10" nRep="98" >
<Disp><![CDATA[Blankscript Iteration 21 (Row 21)]]></Disp>
</NodeArgs>
</DIter>
<DIter rID="T56" iterID="22" >
<Action rID="T57">
<AName><![CDATA[Action]]></AName>
<Summary sTime="11/7/2024 - 9:35:47" eTime="11/7/2024 - 9:35:47" passed="0" failed="0" warnings="0" ></Summary>
<NodeArgs eType="StartAction" icon="2" nRep="103" >
<Disp><![CDATA[Action Summary]]></Disp>
</NodeArgs>
</Action>
<NodeArgs eType="StartIteration" icon="10" nRep="102" >
<Disp><![CDATA[Blankscript Iteration 22 (Row 22)]]></Disp>
</NodeArgs>
</DIter>
<DIter rID="T58" iterID="23" >
<Action rID="T59">
<AName><![CDATA[Action]]></AName>
<Summary sTime="11/7/2024 - 9:35:47" eTime="11/7/2024 - 9:35:47" passed="0" failed="0" warnings="0" ></Summary>
<NodeArgs eType="StartAction" icon="2" nRep="107" >
<Disp><![CDATA[Action Summary]]></Disp>
</NodeArgs>
</Action>
<NodeArgs eType="StartIteration" icon="10" nRep="106" >
<Disp><![CDATA[Blankscript Iteration 23 (Row 23)]]></Disp>
</NodeArgs>
</DIter>
<DIter rID="T60" iterID="24" >
<Action rID="T61">
<AName><![CDATA[Action]]></AName>
<Summary sTime="11/7/2024 - 9:35:47" eTime="11/7/2024 - 9:35:47" passed="0" failed="0" warnings="0" ></Summary>
<NodeArgs eType="StartAction" icon="2" nRep="111" >
<Disp><![CDATA[Action Summary]]></Disp>
</NodeArgs>
</Action>
<NodeArgs eType="StartIteration" icon="10" nRep="110" >
<Disp><![CDATA[Blankscript Iteration 24 (Row 24)]]></Disp>
</NodeArgs>
</DIter>
<DIter rID="T62" iterID="25" >
<Action rID="T63">
<AName><![CDATA[Action]]></AName>
<Summary sTime="11/7/2024 - 9:35:47" eTime="11/7/2024 - 9:35:47" passed="0" failed="0" warnings="0" ></Summary>
<NodeArgs eType="StartAction" icon="2" nRep="115" >
<Disp><![CDATA[Action Summary]]></Disp>
</NodeArgs>
</Action>
<NodeArgs eType="StartIteration" icon="10" nRep="114" >
<Disp><![CDATA[Blankscript Iteration 25 (Row 25)]]></Disp>
</NodeArgs>
</DIter>
<DIter rID="T64" iterID="26" >
<Action rID="T65">
<AName><![CDATA[Action]]></AName>
<Summary sTime="11/7/2024 - 9:35:47" eTime="11/7/2024 - 9:35:47" passed="0" failed="0" warnings="0" ></Summary>
<NodeArgs eType="StartAction" icon="2" nRep="119" >
<Disp><![CDATA[Action Summary]]></Disp>
</NodeArgs>
</Action>
<NodeArgs eType="StartIteration" icon="10" nRep="118" >
<Disp><![CDATA[Blankscript Iteration 26 (Row 26)]]></Disp>
</NodeArgs>
</DIter>
<DIter rID="T66" iterID="27" >
<Action rID="T67">
<AName><![CDATA[Action]]></AName>
<Summary sTime="11/7/2024 - 9:35:47" eTime="11/7/2024 - 9:35:47" passed="0" failed="0" warnings="0" ></Summary>
<NodeArgs eType="StartAction" icon="2" nRep="123" >
<Disp><![CDATA[Action Summary]]></Disp>
</NodeArgs>
</Action>
<NodeArgs eType="StartIteration" icon="10" nRep="122" >
<Disp><![CDATA[Blankscript Iteration 27 (Row 27)]]></Disp>
</NodeArgs>
</DIter>
<DIter rID="T68" iterID="28" >
<Action rID="T69">
<AName><![CDATA[Action]]></AName>
<Summary sTime="11/7/2024 - 9:35:47" eTime="11/7/2024 - 9:35:47" passed="0" failed="0" warnings="0" ></Summary>
<NodeArgs eType="StartAction" icon="2" nRep="127" >
<Disp><![CDATA[Action Summary]]></Disp>
</NodeArgs>
</Action>
<NodeArgs eType="StartIteration" icon="10" nRep="126" >
<Disp><![CDATA[Blankscript Iteration 28 (Row 28)]]></Disp>
</NodeArgs>
</DIter>
<DIter rID="T70" iterID="29" >
<Action rID="T71">
<AName><![CDATA[Action]]></AName>
<Summary sTime="11/7/2024 - 9:35:47" eTime="11/7/2024 - 9:35:47" passed="0" failed="0" warnings="0" ></Summary>
<NodeArgs eType="StartAction" icon="2" nRep="131" >
<Disp><![CDATA[Action Summary]]></Disp>
</NodeArgs>
</Action>
<NodeArgs eType="StartIteration" icon="10" nRep="130" >
<Disp><![CDATA[Blankscript Iteration 29 (Row 29)]]></Disp>
</NodeArgs>
</DIter>
<Action rID="T72">
<AName><![CDATA[vuser_end]]></AName>
<Summary sTime="11/7/2024 - 9:35:47" eTime="11/7/2024 - 9:35:47" passed="0" failed="0" warnings="0" ></Summary>
<NodeArgs eType="StartAction" icon="2" nRep="134" >
<Disp><![CDATA[vuser_end Summary]]></Disp>
</NodeArgs>
</Action>
<Summary sTime="11/7/2024 - 9:35:43" eTime="11/7/2024 - 9:35:47" passed="3" failed="0" warnings="0" ></Summary>
<NodeArgs eType="StartTest" icon="1" nRep="4" status="Passed" >
<Disp><![CDATA[Test Blankscript Summary]]></Disp>
</NodeArgs>
</Doc>
</Report>